{
  "endpoint": "/api/v1/auth/csrf",
  "method": "GET",
  "auth": "required",
  "description": "Returns a CSRF token and sets the XSRF-TOKEN cookie (REQ-SEC-001)",
  "responseFields": [
    { "path": "csrf_token", "type": "string", "required": true, "description": "CSRF token for use in X-CSRF-TOKEN header on mutating requests" }
  ],
  "statusCodes": [200]
}
