{
  "endpoint": "/api/v1/auth/step-up/status",
  "method": "GET",
  "auth": "required",
  "description": "Returns step-up re-authentication status for the current session (REQ-SEC-011)",
  "responseFields": [
    { "path": "step_up_valid", "type": "boolean", "required": true, "description": "Whether step-up is currently valid (within 5-minute window)" },
    { "path": "authenticated_at", "type": "string", "required": true, "description": "ISO 8601 timestamp of step-up authentication" },
    { "path": "expires_at", "type": "string", "required": false, "description": "ISO 8601 timestamp of step-up expiry (null when not valid)" }
  ],
  "statusCodes": [200, 401]
}
